{
  "stable_id": "kri.phishing_suppression_rate@v1",
  "content_version": "0.1.0",
  "maturity": "experimental",
  "kind": "kri",
  "title": "Phishing suppression rate",
  "summary": "Share of inbound phishing-triage runs that terminate via the suppression branch (known-benign sender or already-seen fingerprint inside the suppression window) rather than reaching intent classification. Acts as a false-positive proxy: a creeping suppression rate indicates the reporting funnel is being trained to filter out real reports, while a collapsing rate indicates the suppression catalog is stale. Watched as a band, not a single direction.",
  "unit": "ratio",
  "direction": "lower_is_better",
  "target": { "value": 0.6, "comparator": "<=", "rationale": "Above 0.6 indicates suppression is eating reports the analyst queue should be seeing." },
  "thresholds": [
    { "name": "warn",   "comparator": ">", "value": 0.7, "severity": "warn" },
    { "name": "breach", "comparator": ">", "value": 0.85, "severity": "high" }
  ],
  "measurement": {
    "source": "workflow",
    "aggregation": "ratio",
    "formula": "count(playbook runs ending at the suppression close step) / count(playbook runs ending at any terminal step) over window.",
    "inputs": [
      {
        "name": "suppressed",
        "playbook_ref": "playbook.phishing_triage@v1",
        "playbook_step": "action--c0a17a01-0000-4000-8000-000000000005",
        "description": "count of runs that closed via the suppress-and-close action"
      },
      {
        "name": "total_runs",
        "playbook_ref": "playbook.phishing_triage@v1",
        "playbook_step": "end--c0a17a01-0000-4000-8000-00000000000d",
        "description": "count of all runs reaching the end step (any branch)"
      }
    ],
    "window": { "duration": "P30D", "sliding": true }
  },
  "playbook_refs": [
    { "playbook_id": "playbook.phishing_triage@v1", "step_id": "action--c0a17a01-0000-4000-8000-000000000005" }
  ],
  "external_refs": [
    { "name": "NIS2 Article 21(2)(b) — incident handling", "source": "EUR-Lex", "url": "https://eur-lex.europa.eu/eli/dir/2022/2555/oj", "external_id": "32022L2555" }
  ],
  "maintainer": "metrics-wg@secops-ng.org"
}
