{
  "stable_id": "kpi.coverage_on_call_schedule@v1",
  "content_version": "0.1.0",
  "maturity": "experimental",
  "kind": "kpi",
  "title": "On-call schedule coverage — non-empty roster per shift window",
  "summary": "Share of shift windows in the rolling window whose roster resolution emitted a non-empty primary slot prior to the window opening. The on_call_rotation playbook's load-rotation-roster step writes one resolution per evaluated shift window; this KPI is the ratio of resolutions whose __current_on_call__ is non-empty over total resolutions in window. A coverage gap on a shift window is the operational condition that puts NIS2 Article 21(2)(b) and DORA Article 6 responder-readiness obligations at risk — there is no responder bound for the paging system to page, so no notification-window clock can be honoured.",
  "unit": "ratio",
  "direction": "higher_is_better",
  "target": {
    "value": 1.0,
    "comparator": ">=",
    "rationale": "Every shift window must have a bound primary responder before it opens; a gap is not partial credit."
  },
  "thresholds": [
    {
      "name": "warn",
      "comparator": "<",
      "value": 0.99,
      "severity": "warn"
    },
    {
      "name": "breach",
      "comparator": "<",
      "value": 0.95,
      "severity": "high"
    }
  ],
  "measurement": {
    "source": "workflow",
    "aggregation": "ratio",
    "formula": "count(roster resolutions with non-empty __current_on_call__) / count(roster resolutions) over rolling window.",
    "inputs": [
      {
        "name": "resolutions",
        "playbook_ref": "playbook.on_call_rotation@v1",
        "playbook_step": "action--30000000-0000-4000-8000-000000000002",
        "description": "load-rotation-roster step emissions over window"
      },
      {
        "name": "roster_evidence",
        "control_ref": "control.on_call_roster_governance@v1",
        "description": "roster-governance control attestation pinning the responder bound per shift window"
      }
    ],
    "window": {
      "duration": "P30D",
      "sliding": true
    }
  },
  "playbook_refs": [
    {
      "playbook_id": "playbook.on_call_rotation@v1",
      "step_id": "action--30000000-0000-4000-8000-000000000002"
    }
  ],
  "control_refs": [
    "control.on_call_roster_governance@v1"
  ],
  "telemetry_refs": [
    "telemetry.ocsf.account_change@v1"
  ],
  "external_refs": [
    {
      "name": "NIS2 Directive Article 21(2)(b) — incident-handling capability",
      "source": "EUR-Lex",
      "url": "https://eur-lex.europa.eu/eli/dir/2022/2555/oj"
    },
    {
      "name": "DORA Regulation Article 6 — ICT risk management framework",
      "source": "EUR-Lex",
      "url": "https://eur-lex.europa.eu/eli/reg/2022/2554/oj"
    },
    {
      "name": "ENISA — Good practices for incident response and on-call readiness",
      "source": "ENISA",
      "url": "https://www.enisa.europa.eu/topics/threat-risk-management"
    }
  ],
  "maintainer": "metrics-wg@secops-ng.org"
}
