{
  "stable_id": "kpi.mttd_cloud_misconfig@v1",
  "content_version": "0.1.0",
  "maturity": "experimental",
  "kind": "kpi",
  "title": "Mean time to detect — cloud misconfiguration (MTTD)",
  "summary": "Time between the earliest cloud-control-plane evidence that a posture deviation exists (OCSF Compliance Finding 2003) and the moment the cloud_misconfiguration playbook ingests it. Lower is better. Anchored on ENISA cloud-security guidance and on NIS2 Article 21(2)(e) which obliges operators to maintain a documented vulnerability-handling surface — posture deviations are the cloud-native analogue.",
  "unit": "minutes",
  "direction": "lower_is_better",
  "target": {
    "value": 30,
    "comparator": "<=",
    "rationale": "ENISA good-practice baseline for posture-finding ingestion latency."
  },
  "thresholds": [
    { "name": "warn",   "comparator": ">", "value": 60,  "severity": "warn" },
    { "name": "breach", "comparator": ">", "value": 240, "severity": "critical" }
  ],
  "measurement": {
    "source": "composite",
    "aggregation": "p95",
    "formula": "p95( playbook.ingest_finding.started_at - telemetry.compliance_finding.time ) over confirmed posture findings in window.",
    "inputs": [
      {
        "name": "first_event",
        "telemetry_ref": "telemetry.ocsf.compliance_finding@v1",
        "field": "time",
        "description": "earliest OCSF Compliance Finding event time for the deviation"
      },
      {
        "name": "ingest_started",
        "playbook_ref": "playbook.cloud_misconfiguration@v1",
        "playbook_step": "action--30000000-0000-4000-8000-000000000002",
        "description": "start time of the playbook's ingest-finding step"
      }
    ],
    "window": { "duration": "P30D", "sliding": true }
  },
  "foundation_property": ["operability"],
  "playbook_refs": [
    {
      "playbook_id": "playbook.cloud_misconfiguration@v1",
      "step_id": "action--30000000-0000-4000-8000-000000000002"
    }
  ],
  "detection_refs": [
    "detection.sigma.cspm_finding_critical@v1",
    "detection.sigma.public_storage_bucket@v1"
  ],
  "telemetry_refs": [
    "telemetry.ocsf.compliance_finding@v1"
  ],
  "external_refs": [
    {
      "name": "ENISA — Cloud Security guidance",
      "source": "ENISA",
      "url": "https://www.enisa.europa.eu/topics/cloud-and-big-data"
    },
    {
      "name": "NIS2 Directive (EU) 2022/2555, Article 21(2)(e)",
      "source": "EUR-Lex",
      "url": "https://eur-lex.europa.eu/eli/dir/2022/2555/oj",
      "external_id": "32022L2555"
    },
    {
      "name": "DORA Regulation (EU) 2022/2554, Article 9 — protection and prevention",
      "source": "EUR-Lex",
      "url": "https://eur-lex.europa.eu/eli/reg/2022/2554/oj",
      "external_id": "32022R2554"
    }
  ],
  "maintainer": "metrics-wg@secops-ng.org"
}
